{
    "id": "tD5H6mBGPlMYxWPfOCijXbPj",
    "clientCountryId": "nE85CT2CGFIjvF3h7hRskL3u",
    "clientCountryName": "Cambodia",
    "clientCountryCode": "GM",
    "clientCurrencyId": "FVJkgTpHvxWOqeiFOT0m28KV",
    "clientCurrencyName": "Kwanza",
    "clientCurrencyCode": "BGN",
    "invoiceCountryId": "XUPUC8Jfr0EzUCTi58fTAwBa",
    "invoiceCountryName": "Congo",
    "invoiceCountryCode": "GS",
    "invoiceCurrencyId": "geygAf8wpvluXexrP9SlVmCw",
    "invoiceCurrencyName": "Nuevo Sol",
    "invoiceCurrencyCode": "ERN",
    "owningCountryId": "Ggrgg93IkwJWuTrY7PnuPP1U",
    "owningCountryName": "Canada",
    "owningCountryCode": "JE",
    "owningCurrencyId": "YDBrB6Ds2szaFImfmh9nhrbF",
    "owningCurrencyName": "Saint Helena Pound",
    "owningCurrencyCode": "TTD"
}